{
  "name": "dark-terminal",
  "canvas": {
    "background": "#050505",
    "text": "#e5e7eb",
    "muted": "#9ca3af",
    "grid": "#171717"
  },
  "title": {
    "accent": "#22c55e",
    "highlight": "#101810"
  },
  "node": {
    "radius": 4,
    "stroke_width": 1.6
  },
  "edge": {
    "width": 2,
    "duration": "3.8s"
  },
  "roles": {
    "actor": {"stroke": "#f59e0b", "fill": "#17120a", "text": "#e5e7eb"},
    "source": {"stroke": "#22d3ee", "fill": "#061416", "text": "#e5e7eb"},
    "process": {"stroke": "#22c55e", "fill": "#07130a", "text": "#e5e7eb"},
    "agent": {"stroke": "#a78bfa", "fill": "#120f1f", "text": "#e5e7eb"},
    "memory": {"stroke": "#14b8a6", "fill": "#061513", "text": "#e5e7eb"},
    "tool": {"stroke": "#eab308", "fill": "#181506", "text": "#e5e7eb"},
    "output": {"stroke": "#84cc16", "fill": "#101706", "text": "#e5e7eb"},
    "risk": {"stroke": "#f43f5e", "fill": "#1a0710", "text": "#e5e7eb"},
    "neutral": {"stroke": "#525252", "fill": "#0f0f0f", "text": "#e5e7eb"}
  }
}
